{
  "$schema": "https://json-schema.org/draft/2020-12/schema",
  "$id": "https://fabric.passioncode.ai/agent-contract/0.1.0/schemas/heartbeat.schema.json",
  "title": "Timestamp heartbeat (heartbeat/1, DEC-0054)",
  "description": "A signed timestamp that commits to the revocation delta's head and to the estate revision. A hub signs one at least every 24 hours while it runs (SHOULD hourly) and after every entry and every revision; a machine whose latest heartbeat is more than 72 hours old, or that has not applied up to its head and revision, refuses what arrives from other machines. A machine reports its sequence and at (records.heartbeat, DEC-0053) to its hub over the relay, or through machine.report on the hub's own machine, never in a check-in to an organization server (DEC-0128, DEC-0132). FAC-SEM-083 and the verifier acceptHeartbeat apply.",
  "type": "object",
  "additionalProperties": false,
  "required": [
    "type",
    "alg",
    "estate",
    "sequence",
    "at",
    "deltaHead",
    "estateRecord",
    "kid",
    "sig"
  ],
  "properties": {
    "type": {
      "const": "heartbeat/1"
    },
    "alg": {
      "const": "EdDSA",
      "description": "The estate key's algorithm, signed; EdDSA until Fabric records D2, when ES256 joins additively (DEC-0055 item 9). Anything else is unsupported-alg."
    },
    "estate": {
      "$ref": "activity-common.schema.json#/$defs/opaqueId",
      "description": "The estate whose chain this is: the estate record's estate id."
    },
    "sequence": {
      "type": "integer",
      "minimum": 0,
      "maximum": 9007199254740991,
      "description": "The estate's heartbeat counter: each heartbeat's is above the one before it."
    },
    "at": {
      "$ref": "common.schema.json#/$defs/timestamp",
      "description": "When the heartbeat was signed (RFC 3339 with an offset); at most 60 s ahead of the verifier's clock."
    },
    "deltaHead": {
      "$ref": "revocation-delta.schema.json#/$defs/head"
    },
    "estateRecord": {
      "type": "object",
      "additionalProperties": false,
      "required": [
        "revision",
        "digest"
      ],
      "properties": {
        "revision": {
          "type": "integer",
          "minimum": 1,
          "maximum": 9007199254740991
        },
        "digest": {
          "$ref": "common.schema.json#/$defs/sha256"
        }
      },
      "description": "The latest estate-record revision, with its digest so two revisions with one number are told apart: the shape of a check-in's records.estateRecord (DEC-0056), digest required here."
    },
    "kid": {
      "type": "string",
      "minLength": 1,
      "maxLength": 128,
      "description": "The estate key: the kid of a machine's hubKey that the highest estate-record revision the verifier applied certifies (DEC-0055), not revoked there or by an entry applied before."
    },
    "sig": {
      "type": "string",
      "pattern": "^[A-Za-z0-9_-]{86}$",
      "description": "The 64-byte Ed25519 signature (RFC 8032) over the UTF-8 RFC 8785 form of the document without sig, base64url without padding."
    }
  }
}
