{
  "type": "heartbeat/1",
  "alg": "EdDSA",
  "estate": "estate-5d0f1a",
  "sequence": 0,
  "at": "2026-10-12T09:30:00Z",
  "deltaHead": {
    "sequence": 0,
    "sha256": "eeed1162e2371d24eeb238e7b568fe95871936219c5e7719fa5080530b8e8b1f"
  },
  "estateRecord": {
    "revision": 3,
    "digest": "sha256:070512bd06a81493e33a1540eed836621eb220c252d94b3bb580d8478e9d32b4"
  },
  "kid": "hub-m-4c1e-1",
  "sig": "frujsT-WhLYXpfyXkjbUBRgi0_s4V82TWfHbA7DBLNGqm6SGSXj6Qf_HPq13PI3BhqNsbtf7imtCdnv-mijeCA"
}
